"updatedAt","title","summaryPreview","link","pubDate"
"2026-06-03T23:07:17.252Z","""월드컵 특수 없다""…치킨업계, 원가상승·소비침체 '겹악재'","이에 따라 해당 시즌 국내 주요 치킨 프랜차이즈 업계인 BBQ와 교촌치킨, BHC 등의 매출은 각각 1.7배, 1.4배, 2배 가량 증가한 바 있다. 그러나 이번 한국 대표팀 월드...","https://n.news.naver.com/mnews/article/119/0003097547?sid=101","Thu, 04 Jun 2026 07:47:00 +0900"
"2026-06-03T23:07:17.252Z","[투자노트] ‘삼겹살 회동 D-1’… 젠슨 황 랠리, 진짜 수혜주 찾아라","당시 세 사람이 치킨집에서 만났다는 사실만으로도 다음 날 교촌에프엔비 주가가 장중 15% 넘게 오르는 진풍경이 연출됐다. 방한 전부터 관련 기업들의 주가도 요동치고 있다. LG전자...","https://n.news.naver.com/mnews/article/366/0001169289?sid=101","Thu, 04 Jun 2026 07:25:00 +0900"
"2026-06-03T23:07:17.252Z","[소비자민원평가-치킨] 중량·가격차 등 '서비스' 민원 최다...bhc, 민원...","지난해 소비자고발센터(www.goso.co.kr)에 제기된 bhc(다이닝브랜즈그룹), BBQ, 교촌치킨, 굽네치킨, 네네치킨 등 치킨 대표기업 다섯 곳에 대한 민원을 분석한 결과...","http://www.consumernews.co.kr/news/articleView.html?idxno=756817","Thu, 04 Jun 2026 06:10:00 +0900"
"2026-06-03T23:07:17.252Z","BBQ vs bhc vs 교촌, '3사3색' 글로벌 공략 차별화 전략은","사진=함영원 기자 국내 대표 치킨브랜드 3사인 BBQ와 bhc, 교촌치킨이 서로 다른 전략으로 글로벌 영토 확장에 집중하고 있어 주목된다. 현재 가장 많은 해외 매장을 운영 중인...","https://www.pointdaily.co.kr/news/articleView.html?idxno=306577","Thu, 04 Jun 2026 02:46:00 +0900"
"2026-06-03T23:07:17.252Z","고병원성 AI에 닭고기 부족...가맹점은 발 동동, 업체는 양 줄여","교촌치킨과 bhc 등 일부 가맹점은 지난해 말부터 필요한 물량을 충분히 공급받지 못하고 있다. 교촌치킨 가맹점주 A 씨는 ""매일 부위별로 30~40㎏은 들어와야 하는데 10㎏밖에...","https://www.ppss.kr/news/articleView.html?idxno=297657","Wed, 03 Jun 2026 21:25:00 +0900"
"2026-06-03T23:07:17.252Z","월드컵 야식 특수 없겠네…울고 싶은 치킨·주류업계","교촌치킨, BBQ, bhc 등 주요 치킨 프랜차이즈가 과거 월드컵과 올림픽 때 누린 주문 급증 효과가 크지 않을 것이란 관측이 나온다. 주류업계의 고민은 더 깊다. 술을 의식적으로...","https://n.news.naver.com/mnews/article/015/0005294517?sid=101","Wed, 03 Jun 2026 19:02:00 +0900"
"2026-06-03T23:07:17.252Z","양분하는 외식 트렌드...검증된 '맛집' vs 나만의 '소확행'","사진=교촌치킨, 맘스터치, 이지화이트브레드 올해로 창립 35주년을 맞은 교촌치킨은 간장·레드·허니 등 3대 대표 소스를 중심으로 브랜드 정체성을 구축하며 '국민 치킨 브랜드'로 자...","https://www.slist.kr/news/articleView.html?idxno=743036","Wed, 03 Jun 2026 09:46:00 +0900"
"2026-06-03T23:07:17.252Z","치맥 아니어도 ‘월드컵은 특수’…유통가, ‘집관족’ 틈새 공략 총력","교촌치킨·BBQ·bhc 등 주요 프랜차이즈는 자사 앱 할인과 배달·포장 중심 프로모션으로 대응에 나선다. 이벤트성 마케팅보다는 상시 할인과 고객 유입 전략에 주력할 방침이다. 치킨...","https://n.news.naver.com/mnews/article/117/0004070826?sid=103","Tue, 02 Jun 2026 20:08:00 +0900"
"2026-06-03T23:07:17.252Z","‘삼겹살 관련주’까지 찾는 개미들…‘젠슨황 추적 사이트’ 나왔다","실제 지난해 10월 ‘치맥 회동’ 당일 교촌에프앤비와 하림, 마니커에프앤지 등 치킨 및 닭고기 관련주가 급등한 바 있다. 이에 투자자들은 돼지고기 및 축산 관련주의 ‘종목토론방’에...","https://n.news.naver.com/mnews/article/081/0003649049?sid=101","Tue, 02 Jun 2026 19:35:00 +0900"
"2026-06-03T23:07:17.252Z","교촌치킨 3년째 닭고기 수급난… 속타는 가맹점주","교촌치킨이 3년째 닭고기 수급난에 허덕이면서 월드컵 성수기를 앞둔 가맹점주들의 속이 까맣게 타고 있다. 교촌치킨을 운영하는 교촌에프앤비는 공급처를 확보하기 위해 안간힘을 쓰고 있지...","https://n.news.naver.com/mnews/article/082/0001383526?sid=101","Tue, 02 Jun 2026 18:08:00 +0900"
